{
  "schemaVersion": "0",
  "name": "fd",
  "version": "10.4.2",
  "description": "Simple, fast and user-friendly alternative to find",
  "homepage": "https://github.com/sharkdp/fd",
  "license": "Apache-2.0 OR MIT",
  "type": "portable-cli",
  "upstream": {
    "source": "homebrew-formula-api",
    "tap": "homebrew/core",
    "formulaPath": "Formula/f/fd.rb",
    "formulaSha256": "aa911f2b1201caeaa27bc678bfa198369bf5f8965fb9486110e99b2986a0ebfa",
    "githubRepository": "sharkdp/fd",
    "githubReleaseTag": "v10.4.2"
  },
  "platforms": {
    "windows": {
      "arches": {
        "x64": {
          "url": "https://github.com/sharkdp/fd/releases/download/v10.4.2/fd-v10.4.2-x86_64-pc-windows-msvc.zip",
          "sha256": "b2816e506390a89941c63c9187d58a3cc10e9a55f2ef0685f9ea0eccaf7c98c8",
          "extract": {
            "type": "zip",
            "sourcePath": "fd-v10.4.2-x86_64-pc-windows-msvc"
          }
        },
        "arm64": {
          "url": "https://github.com/sharkdp/fd/releases/download/v10.4.2/fd-v10.4.2-aarch64-pc-windows-msvc.zip",
          "sha256": "4f9110c2d5b33a7f760bfa5510f4c113d828109f7277d421b1053a9943c0fc92",
          "extract": {
            "type": "zip",
            "sourcePath": "fd-v10.4.2-aarch64-pc-windows-msvc"
          }
        }
      }
    }
  },
  "bin": [
    {
      "name": "fd",
      "path": "fd.exe"
    }
  ],
  "resources": [],
  "conflicts": [],
  "test": {
    "command": "fd --version",
    "match": "10\\.4\\.2"
  },
  "livecheck": {
    "type": "github-release",
    "repository": "sharkdp/fd"
  }
}
