{
  "schemaVersion": "0",
  "name": "fastfetch",
  "version": "2.63.1",
  "description": "Like neofetch, but much faster because written mostly in C",
  "homepage": "https://github.com/fastfetch-cli/fastfetch",
  "license": "MIT",
  "type": "portable-cli",
  "upstream": {
    "source": "homebrew-formula-api",
    "tap": "homebrew/core",
    "formulaPath": "Formula/f/fastfetch.rb",
    "formulaSha256": "34ad6dc690e74bc6af89c0952a02f6be2dafdd85ac1f5eeccefa10665bd78c0d",
    "githubRepository": "fastfetch-cli/fastfetch",
    "githubReleaseTag": "2.63.1"
  },
  "platforms": {
    "windows": {
      "arches": {
        "x64": {
          "url": "https://github.com/fastfetch-cli/fastfetch/releases/download/2.63.1/fastfetch-windows-amd64.zip",
          "sha256": "2de11119cbd874c7ecc82ecf4c09711f397a7407c85a1857256c5bf1139fc6f6",
          "extract": {
            "type": "zip",
            "sourcePath": ""
          }
        }
      }
    }
  },
  "bin": [
    {
      "name": "fastfetch",
      "path": "fastfetch.exe"
    }
  ],
  "resources": [],
  "conflicts": [],
  "test": {
    "command": "fastfetch --version",
    "match": "2\\.63\\.1"
  },
  "livecheck": {
    "type": "github-release",
    "repository": "fastfetch-cli/fastfetch"
  }
}
