{
  "schemaVersion": "0",
  "name": "uv",
  "version": "0.11.14",
  "description": "Extremely fast Python package installer and resolver, written in Rust",
  "homepage": "https://docs.astral.sh/uv/",
  "license": "Apache-2.0 OR MIT",
  "type": "portable-cli",
  "upstream": {
    "source": "homebrew-formula-api",
    "tap": "homebrew/core",
    "formulaPath": "Formula/u/uv.rb",
    "formulaSha256": "4c1bf977f542383b67a6ccbfa18a8840a31dcc6304962ab2b2e4e85dff03b128",
    "githubRepository": "astral-sh/uv",
    "githubReleaseTag": "0.11.14"
  },
  "platforms": {
    "windows": {
      "arches": {
        "x64": {
          "url": "https://github.com/astral-sh/uv/releases/download/0.11.14/uv-x86_64-pc-windows-msvc.zip",
          "sha256": "52ba5d19409aaa688a8a1a6ec8dfb6a4817230d20186e75f4006105c3e39a846",
          "extract": {
            "type": "zip",
            "sourcePath": ""
          }
        },
        "arm64": {
          "url": "https://github.com/astral-sh/uv/releases/download/0.11.14/uv-aarch64-pc-windows-msvc.zip",
          "sha256": "d66c76ba912ba66fed011e0189dfbc4527dd9e620a2b5d5d5ecd2ad8936601b8",
          "extract": {
            "type": "zip",
            "sourcePath": ""
          }
        }
      }
    }
  },
  "bin": [
    {
      "name": "uv",
      "path": "uv.exe"
    },
    {
      "name": "uvx",
      "path": "uvx.exe"
    }
  ],
  "resources": [],
  "conflicts": [],
  "test": {
    "command": "uv --version",
    "match": "0\\.11\\.14"
  },
  "livecheck": {
    "type": "github-release",
    "repository": "astral-sh/uv"
  }
}
