{
  "schemaVersion": "0",
  "name": "actionlint",
  "version": "1.7.12",
  "description": "Static checker for GitHub Actions workflow files",
  "homepage": "https://rhysd.github.io/actionlint/",
  "license": "MIT",
  "type": "portable-cli",
  "upstream": {
    "source": "homebrew-formula-api",
    "tap": "homebrew/core",
    "formulaPath": "Formula/a/actionlint.rb",
    "formulaSha256": "6296c22185799ce1c197a549054be47d4c067ecccb4c80098544be282cd3fb93",
    "githubRepository": "rhysd/actionlint",
    "githubReleaseTag": "v1.7.12"
  },
  "platforms": {
    "windows": {
      "arches": {
        "x64": {
          "url": "https://github.com/rhysd/actionlint/releases/download/v1.7.12/actionlint_1.7.12_windows_amd64.zip",
          "sha256": "6e7241b51e6817ea6a047693d8e6fed13b31819c9a0dd6c5a726e1592d22f6e9",
          "extract": {
            "type": "zip",
            "sourcePath": ""
          }
        },
        "arm64": {
          "url": "https://github.com/rhysd/actionlint/releases/download/v1.7.12/actionlint_1.7.12_windows_arm64.zip",
          "sha256": "cadcf7ea4efe3a68728893813643cebe1185e5b1d4be5b96245f65c9a4d5ea41",
          "extract": {
            "type": "zip",
            "sourcePath": ""
          }
        }
      }
    }
  },
  "bin": [
    {
      "name": "actionlint",
      "path": "actionlint.exe"
    }
  ],
  "resources": [],
  "conflicts": [],
  "test": {
    "command": "actionlint --version",
    "match": "1\\.7\\.12"
  },
  "livecheck": {
    "type": "github-release",
    "repository": "rhysd/actionlint"
  }
}
